{
  "name": "validate-idea",
  "kind": "extension-pack",
  "source": {
    "manifest": "skills/validate-idea/.source.json"
  },
  "hosts": ["claude", "codex"],
  "runtime": {
    "required": false,
    "dependencies": []
  },
  "capabilities": ["validation", "research", "market-fit"],
  "workflow_integration": {
    "default_mode": "standalone",
    "can_attach_to_runner": false
  },
  "docs": {
    "zh_cn": "skills/validate-idea/SKILL.md"
  },
  "security": {
    "network_required": false,
    "writes_outside_repo": false
  }
}
